channel,dateCreated,geography,guid,headline,id,language,mediaType,priority,slug,source,version
STK567,25/03/2022 10:00:00,CH|GB|DE|US,"tag:reuters.com,2022:newsml_L2N2VQ226","INSIGHT-Drugmakers, scientists begin the hunt for long COVID treatments","tag:reuters.com,2022:newsml_L2N2VQ226:388674253",en,T,3,"HEALTH-CORONAVIRUS/LONGCOVID (INSIGHT, PIX)","Thomson Reuters",388674253
STK567,25/03/2022 09:59:20,RU|IT|UA,"tag:reuters.com,2022:newsml_L5N2VS25N","Russian ambassador sues Italian daily over Putin article","tag:reuters.com,2022:newsml_L5N2VS25N:1754552500",en,T,3,"UKRAINE-CRISIS/ITALY-RUSSIA (PIX, TV)","Thomson Reuters",1754552500
STK567,25/03/2022 09:57:35,CN,"tag:reuters.com,2022:newsml_L3N2VS23G","Badminton-Four Chinese men's doubles players get suspended three-month bans","tag:reuters.com,2022:newsml_L3N2VS23G:92187662",en,T,3,"BADMINTON-CHINA/","Thomson Reuters",92187662
STK567,25/03/2022 09:51:17,AU|GB|JP|NZ|CN|CA|US,"tag:reuters.com,2022:newsml_L2N2VS0JL","FOREX-Euro edges higher as focus on Ukraine, yen rebounds vs dollar","tag:reuters.com,2022:newsml_L2N2VS0JL:1434951035",en,T,3,"GLOBAL-FOREX/","Thomson Reuters",1434951035
STK567,25/03/2022 09:49:22,RU|US|UA|PL,"tag:reuters.com,2022:newsml_MT1ALTL5N2VS2EJ1","U.N. REFUGEE AGENCY OFFICIAL IN UKRAINE SAYS AROUND 3.7 MILLION PEOPLE HAVE LEFT UKRAINE SINCE CONFLICT BEGAN","tag:reuters.com,2022:newsml_MT1ALTL5N2VS2EJ1:1113003648",en,T,1,"U.N. REFUGEE AGENCY OFFICIAL IN UKRAINE SAYS AROUND 3.7 MILLION","Thomson Reuters",1113003648
STK567,25/03/2022 09:47:59,RU|GB,"tag:reuters.com,2022:newsml_L3N2VS1VM","UPDATE 1-Oil majors, weak economic data keep FTSE 100 under pressure","tag:reuters.com,2022:newsml_L3N2VS1VM:94998568",en,T,3,"BRITAIN-STOCKS/ (UPDATE 1)","Thomson Reuters",94998568
STK567,25/03/2022 09:47:49,KR|CN,"tag:reuters.com,2022:newsml_MT1ALTB9N2VI02B4","CHINA'S PRESIDENT XI SAYS CHINA IS WILLING TO WORK WITH SOUTH KOREA TO SMOOTH FLOW OF GLOBAL SUPPLY CHAIN","tag:reuters.com,2022:newsml_MT1ALTB9N2VI02B4:1184760300",en,T,1,"CHINA'S PRESIDENT XI SAYS CHINA IS WILLING TO WORK WITH SOUTH KO","Thomson Reuters",1184760300
STK567,25/03/2022 09:46:49,RU|KR|KP|JP|CN|US,"tag:reuters.com,2022:newsml_T9N2JJ01S","S.Korea's President-elect asks China's Xi for cooperation after N.Korea's ICBM launch","tag:reuters.com,2022:newsml_T9N2JJ01S:2000242979",en,T,2,"NORTHKOREA-MISSILES/XI (URGENT)","Thomson Reuters",2000242979
STK567,25/03/2022 09:45:27,RU|AU|JP|BY|US|UA|PL,"tag:reuters.com,2022:newsml_L2N2VS08N","TOP WRAP 5-Ukrainian forces advance east of Kyiv as Russians fall back","tag:reuters.com,2022:newsml_L2N2VS08N:309994150",en,T,3,"UKRAINE-CRISIS/ (TOP WRAP 5, PIX, GRAPHIC)","Thomson Reuters",309994150
STK567,25/03/2022 09:44:43,KR|CN,"tag:reuters.com,2022:newsml_MT1ALTB9N2VI02B2","CHINA'S PRESIDENT XI, IN PHONE CALL WITH SOUTH KOREA PRESIDENT-ELECT YOON, SAYS CHINA, SOUTH KOREA SHOULD INCREASE POLITICAL MUTUAL TRUST","tag:reuters.com,2022:newsml_MT1ALTB9N2VI02B2:1856185968",en,T,1,"CHINA'S PRESIDENT XI, IN PHONE CALL WITH SOUTH KOREA PRESIDENT-E","Thomson Reuters",1856185968
STK567,25/03/2022 09:42:53,GB|US,"tag:reuters.com,2022:newsml_L5N2VS2B6","Sterling falls after retail sales miss, worsening consumer confidence","tag:reuters.com,2022:newsml_L5N2VS2B6:1057990277",en,T,3,"BRITAIN-STERLING/","Thomson Reuters",1057990277
STK567,25/03/2022 09:41:36,CN,"tag:reuters.com,2022:newsml_L2N2VS0GJ","UPDATE 1-Hong Kong govt to resume services on April 1 as city logs lowest  infections in a month","tag:reuters.com,2022:newsml_L2N2VS0GJ:219692043",en,T,3,"HEALTH-CORONAVIRUS/HONGKONG (UPDATE 1)","Thomson Reuters",219692043
STK567,25/03/2022 09:41:22,,"tag:reuters.com,2022:newsml_MTZXEI3PA2VJ19","UPDATE 8-NBA Standings","tag:reuters.com,2022:newsml_MTZXEI3PA2VJ19:8",en,T,4,"BASKETBALL-NBA/STANDINGS (UPDATE 8)","Opta Sports Data",8
STK567,25/03/2022 09:40:03,RU,"tag:reuters.com,2022:newsml_L2N2VS0D6","UPDATE 1-Airline Aeroflot leads Russian stock slide on 2nd day of trade","tag:reuters.com,2022:newsml_L2N2VS0D6:345252537",en,T,3,"RUSSIA-MARKETS/ (UPDATE 1)","Thomson Reuters",345252537
STK567,25/03/2022 09:39:41,ES,"tag:reuters.com,2022:newsml_L5N2VS1O4","UPDATE 1-Power costs drive Spanish industrial prices to record high","tag:reuters.com,2022:newsml_L5N2VS1O4:749757451",en,T,3,"SPAIN-ECONOMY/INFLATION (UPDATE 1)","Thomson Reuters",749757451
STK567,25/03/2022 09:39:12,CN,"tag:reuters.com,2022:newsml_B9N2VI01Q","China to finish preparation for establishing financial stability guarantee fund by Sept","tag:reuters.com,2022:newsml_B9N2VI01Q:430231824",en,T,2,"CHINA-FINANCE/ (URGENT)","Thomson Reuters",430231824
STK567,25/03/2022 09:38:24,CN,"tag:reuters.com,2022:newsml_L2N2VS0BC","UPDATE 2-Hong Kong leader rejects barrister nominee to sensitive judges panel, appoints another","tag:reuters.com,2022:newsml_L2N2VS0BC:571619615",en,T,3,"HONGKONG-SECURITY/LEGAL (UPDATE 2, PIX)","Thomson Reuters",571619615
STK567,25/03/2022 09:36:08,RU|KR|KP|JP|CN|US,"tag:reuters.com,2022:newsml_MT1ALTT9N2JJ01S4","S.KOREA'S PRESIDENT-ELECT YOON ASKS CHINA'S XI FOR CLOSE COOPERATION FOLLOWING NORTH KOREA'S ICBM LAUNCH - S.KOREA'S TRANSITION COMMITTEE","tag:reuters.com,2022:newsml_MT1ALTT9N2JJ01S4:1113745986",en,T,1,"S.KOREA'S PRESIDENT-ELECT YOON ASKS CHINA'S XI FOR CLOSE COOPERA","Thomson Reuters",1113745986
STK567,25/03/2022 09:35:43,RU|CN|US|UA|IN,"tag:reuters.com,2022:newsml_D8N2F300N","India and China for immediate ceasefire in Ukraine - Indian foreign minister","tag:reuters.com,2022:newsml_D8N2F300N:770038413",en,T,2,"UKRAINE-CRISIS/INDIA-CHINA (URGENT)","Thomson Reuters",770038413
STK567,25/03/2022 09:34:52,RU|KR|KP|JP|CN|US,"tag:reuters.com,2022:newsml_L3N2VS1QL","N.Korea media give Kim Jong Un 'Top Gun' treatment in missile coverage","tag:reuters.com,2022:newsml_L3N2VS1QL:1292967496",en,T,3,"NORTHKOREA-MISSILES/MOVIE (PIX, TV)","Thomson Reuters",1292967496
STK567,25/03/2022 09:33:58,RU|KR|KP|JP|CN|US,"tag:reuters.com,2022:newsml_MT1ALTT9N2JJ01S2","S.KOREA'S PRESIDENT-ELECT YOON TELLS CHINA'S XI CLOSE COOPERATION ON MANAGING KOREAN PENINSULA SITUATION IS NEEDED - YONHAP","tag:reuters.com,2022:newsml_MT1ALTT9N2JJ01S2:1920900963",en,T,1,"S.KOREA'S PRESIDENT-ELECT YOON TELLS CHINA'S XI CLOSE COOPERATIO","Thomson Reuters",1920900963
STK567,25/03/2022 09:32:56,RU|UA,"tag:reuters.com,2022:newsml_L5N2VS1T7","UPDATE 2-US, EU strike LNG deal as Europe seeks to cut Russian gas","tag:reuters.com,2022:newsml_L5N2VS1T7:219584080",en,T,3,"UKRAINE-CRISIS/EU-ENERGY (UPDATE 2, PIX)","Thomson Reuters",219584080
STK567,25/03/2022 09:32:36,RU|US|UA,"tag:reuters.com,2022:newsml_L2N2VS0DR","EXCLUSIVE-Russian missiles in Ukraine have failure rate of up to 60%, U.S. officials say","tag:reuters.com,2022:newsml_L2N2VS0DR:1743722253",en,T,3,"UKRAINE-CRISIS/USA-MISSILES (UPDATE 1, EXCLUSIVE, PIX)","Thomson Reuters",1743722253
STK567,25/03/2022 09:31:41,RU|AF|CN|UA|IN,"tag:reuters.com,2022:newsml_D8N2F300M","India foreign minister says ties with China can't be normal with border tension","tag:reuters.com,2022:newsml_D8N2F300M:235071136",en,T,2,"INDIA-CHINA/MINISTER (URGENT)","Thomson Reuters",235071136
STK567,25/03/2022 09:28:49,RU|GB|UA,"tag:reuters.com,2022:newsml_L5N2VS25J","UK minister to take in Ukrainian refugee family","tag:reuters.com,2022:newsml_L5N2VS25J:174150498",en,T,3,"UKRAINE-CRISIS/BRITAIN-MINISTER","Thomson Reuters",174150498
STK567,25/03/2022 09:27:48,RU|DE|US|UA,"tag:reuters.com,2022:newsml_L5N2VS1R0","U.S. LNG will help reduce EU's Russian gas dependency, von der Leyen says","tag:reuters.com,2022:newsml_L5N2VS1R0:996213607",en,T,3,"UKRAINE-CRISIS/EU-VONDERLEYEN","Thomson Reuters",996213607
STK567,25/03/2022 09:26:37,SA|DE|US,"tag:reuters.com,2022:newsml_L2N2VS0CY","UPDATE 2-Motor racing-Hulkenberg steps in again for Vettel in Saudi Arabia","tag:reuters.com,2022:newsml_L2N2VS0CY:331380332",en,T,3,"MOTOR-F1-SAUDI/ (UPDATE 2, PIX, TV)","Thomson Reuters",331380332
STK567,25/03/2022 09:24:15,CN|IN,"tag:reuters.com,2022:newsml_MT1ALTD8N2F300N6","INDIA'S FOREIGN MINISTER SAYS  CHINA DID NOT WANT CHINESE FOREIGN MINISTER'S VISIT TO INDIA TO BE ANNOUNCED IN ADVANCE","tag:reuters.com,2022:newsml_MT1ALTD8N2F300N6:1115151508",en,T,1,"INDIA'S FOREIGN MINISTER SAYS  CHINA DID NOT WANT CHINESE FOREIG","Thomson Reuters",1115151508
STK567,25/03/2022 09:23:11,CN,"tag:reuters.com,2022:newsml_MT1ALTB9N2VI01Q2","CHINA SAYS TO COMPLETE THE PREPARATION WORK TO ESTABLISH A FINANCIAL STABILITY GUARANTEE FUND BY END SEPTEMBER  - CABINET DOCUMENT","tag:reuters.com,2022:newsml_MT1ALTB9N2VI01Q2:2011200481",en,T,1,"CHINA SAYS TO COMPLETE THE PREPARATION WORK TO ESTABLISH A FINAN","Thomson Reuters",2011200481
STK567,25/03/2022 09:23:07,RU|IT|TR|FR|US|UA,"tag:reuters.com,2022:newsml_L5N2VS1Q2","Erdogan says Turkey's position on procurement of Russian S-400s unchanged -media","tag:reuters.com,2022:newsml_L5N2VS1Q2:1985885946",en,T,2,"TURKEY-USA/DEFENCE-ERDOGAN (URGENT)","Thomson Reuters",1985885946
STK567,25/03/2022 09:22:35,AU|CN,"tag:reuters.com,2022:newsml_L5N2VS25V","Cheng Lei to be tried in Beijing next week - ABC News","tag:reuters.com,2022:newsml_L5N2VS25V:505044113",en,T,3,"AUSTRALIA-CHINA/CHENGLEI-TRIAL","Thomson Reuters",505044113
STK567,25/03/2022 09:22:27,KR|CN,"tag:reuters.com,2022:newsml_MT1ALTB9N2VI02A2","CHINESE PRESIDENT XI SPOKE WITH SOUTH KOREAN PRESIDENT YOON - STATE MEDIA","tag:reuters.com,2022:newsml_MT1ALTB9N2VI02A2:264938456",en,T,1,"CHINESE PRESIDENT XI SPOKE WITH SOUTH KOREAN PRESIDENT YOON - ST","Thomson Reuters",264938456
STK567,25/03/2022 09:22:05,RU|US|UA,"tag:reuters.com,2022:newsml_A5N2VD004","U.S. to sell more LNG to Europe to help it cut dependence on Russia - Biden","tag:reuters.com,2022:newsml_A5N2VD004:789565386",en,T,2,"UKRAINE-CRISIS/EU-US (URGENT)","Thomson Reuters",789565386
STK567,25/03/2022 09:21:44,CN|IN,"tag:reuters.com,2022:newsml_MT1ALTD8N2F300N4","INDIA'S FOREIGN MINISTER SAYS  HOPES CHINA CAN FOLLOW INDEPENDENT POLICY ON RELATIONSHIP WITH INDIA","tag:reuters.com,2022:newsml_MT1ALTD8N2F300N4:770513708",en,T,1,"INDIA'S FOREIGN MINISTER SAYS  HOPES CHINA CAN FOLLOW INDEPENDEN","Thomson Reuters",770513708
STK567,25/03/2022 09:19:46,CH|IT|GB|FR|DE|ES,"tag:reuters.com,2022:newsml_L3N2VS1V9","REFILE-European shares slip as crisis in Ukraine deepens","tag:reuters.com,2022:newsml_L3N2VS1V9:81967639",en,T,2,"EUROPE-STOCKS/ (CORRECTED, URGENT)","Thomson Reuters",81967639
STK567,25/03/2022 09:18:53,PK,"tag:reuters.com,2022:newsml_L5N2VS1D1","Pakistan opposition calls foul as Khan no confidence motion delayed till Monday","tag:reuters.com,2022:newsml_L5N2VS1D1:1537295017",en,T,3,"PAKISTAN-POLITICS/ (PIX)","Thomson Reuters",1537295017
STK567,25/03/2022 09:18:37,RU|US|UA,"tag:reuters.com,2022:newsml_MT1ALTD8N2F300N2","INDIA'S FOREIGN MINISTER SAYS  AGREED WITH CHINESE COUNTERPART ON IMPORTANCE OF AN IMMEDIATE CEASEFIRE IN UKRAINE","tag:reuters.com,2022:newsml_MT1ALTD8N2F300N2:1120475786",en,T,1,"INDIA'S FOREIGN MINISTER SAYS  AGREED WITH CHINESE COUNTERPART O","Thomson Reuters",1120475786
STK567,25/03/2022 09:18:12,GB|DE,"tag:reuters.com,2022:newsml_MT1ALTL5N2VS1R11","GERMAN HEALTH MINISTER SAYS HAVE ASKED STIKO TO REVISE RECOMMENDATION FOR FOURTH COVID SHOT, URGE PEOPLE OVER 60 WITH RISK FACTORS TO GET SECOND BOOSTER","tag:reuters.com,2022:newsml_MT1ALTL5N2VS1R11:1621752425",en,T,1,"GERMAN HEALTH MINISTER SAYS HAVE ASKED STIKO TO REVISE RECOMMEND","Thomson Reuters",1621752425
STK567,25/03/2022 09:17:57,KR|KP|US,"tag:reuters.com,2022:newsml_L2N2VR2VM","WRAPUP 4-N.Korea tests new intercontinental missile for 'long' confrontation with U.S.","tag:reuters.com,2022:newsml_L2N2VR2VM:1274176959",en,T,3,"NORTHKOREA-MISSILES/ (WRAPUP 4, PIX, TV)","Thomson Reuters",1274176959
STK567,25/03/2022 09:17:26,CN|IN,"tag:reuters.com,2022:newsml_MT1ALTD8N2F300P4","INDIA'S FOREIGN MINISTER SAYS  MILITARY TALKS HAVE MADE PROGRESS BUT NOT SORTED OUT ISSUES IN ENTIRETY","tag:reuters.com,2022:newsml_MT1ALTD8N2F300P4:1284578401",en,T,1,"INDIA'S FOREIGN MINISTER SAYS  MILITARY TALKS HAVE MADE PROGRESS","Thomson Reuters",1284578401
STK567,25/03/2022 09:17:22,RU|UA,"tag:reuters.com,2022:newsml_L5N2VS20G","Ukrainian city of Chernihiv cut off by Russian forces - regional governor","tag:reuters.com,2022:newsml_L5N2VS20G:224152593",en,T,2,"UKRAINE-CRISIS/CHERNIHIV (URGENT)","Thomson Reuters",224152593
STK567,25/03/2022 09:16:51,CN|IN,"tag:reuters.com,2022:newsml_MT1ALTD8N2F300P2","INDIA'S FOREIGN MINISTER SAYS  RELATIONSHIP WITH CHINA NOT NORMAL TODAY BECAUSE OF PRESENCE OF LARGE NUMBER OF CHINESE TROOPS ALONG BORDER","tag:reuters.com,2022:newsml_MT1ALTD8N2F300P2:479879764",en,T,1,"INDIA'S FOREIGN MINISTER SAYS  RELATIONSHIP WITH CHINA NOT NORMA","Thomson Reuters",479879764
STK567,25/03/2022 09:15:42,RU|US|UA,"tag:reuters.com,2022:newsml_MT1ALTA5N2VD0026","EU'S VON DER LEYEN:  EUROPE WILL WORK TO ENSURE STABLE DEMAND FOR ADDITIONAL U.S. LNG UNTIL AT LEAST 2030","tag:reuters.com,2022:newsml_MT1ALTA5N2VD0026:509191010",en,T,1,"EU'S VON DER LEYEN:  EUROPE WILL WORK TO ENSURE STABLE DEMAND FO","Thomson Reuters",509191010
STK567,25/03/2022 09:15:36,RU|US|UA,"tag:reuters.com,2022:newsml_MT1ALTA5N2VD0024","EU'S VON DER LEYEN:  THE LNG FROM U.S. WILL REPLACE LNG FROM RUSSIA","tag:reuters.com,2022:newsml_MT1ALTA5N2VD0024:1454090910",en,T,1,"EU'S VON DER LEYEN:  THE LNG FROM U.S. WILL REPLACE LNG FROM RUS","Thomson Reuters",1454090910
STK567,25/03/2022 09:15:29,RU|US|UA,"tag:reuters.com,2022:newsml_MT1ALTA5N2VD0022","EU'S VON DER LEYEN: U.S. COMMITMENT TO PROVIDE ADDITIONAL 15 BCM OF LNG IS A BIG STEP TOWARDS REDUCING DEPENDENCY ON RUSSIAN GAS","tag:reuters.com,2022:newsml_MT1ALTA5N2VD0022:598636046",en,T,1,"EU'S VON DER LEYEN: U.S. COMMITMENT TO PROVIDE ADDITIONAL 15 BCM","Thomson Reuters",598636046
STK567,25/03/2022 09:14:46,RU,"tag:reuters.com,2022:newsml_R4N2UF007","Doctors fighting for life of veteran Russian politician Zhirinovsky - parliament speaker","tag:reuters.com,2022:newsml_R4N2UF007:406720074",en,T,2,"RUSSIA-POLITICS/ZHIRINOVSKY (URGENT)","Thomson Reuters",406720074
STK567,25/03/2022 09:12:44,RU|US|UA,"tag:reuters.com,2022:newsml_MT1ALTA5N2VD0032","EU'S VON DER LEYEN:  THIS WAR WILL BE A STRATEGIC FAILURE FOR PUTIN","tag:reuters.com,2022:newsml_MT1ALTA5N2VD0032:721238389",en,T,1,"EU'S VON DER LEYEN:  THIS WAR WILL BE A STRATEGIC FAILURE FOR PU","Thomson Reuters",721238389
STK567,25/03/2022 09:12:44,RU|FI|UA,"tag:reuters.com,2022:newsml_L5N2VS1QI","Finland suspends train connections to Russia","tag:reuters.com,2022:newsml_L5N2VS1QI:275002029",en,T,3,"UKRAINE-CRISIS/FINLAND-RUSSIA (PIX)","Thomson Reuters",275002029
STK567,25/03/2022 09:12:21,RU|AF|CN|UA|IN,"tag:reuters.com,2022:newsml_MT1ALTD8N2F300M14","INDIA'S FOREIGN MINISTER SAYS  TALKS OVERALL ADDED CLARITY ON BILATERAL RELATIONS","tag:reuters.com,2022:newsml_MT1ALTD8N2F300M14:791237092",en,T,1,"INDIA'S FOREIGN MINISTER SAYS  TALKS OVERALL ADDED CLARITY ON BI","Thomson Reuters",791237092
STK567,25/03/2022 09:11:45,RU|AF|CN|UA|IN,"tag:reuters.com,2022:newsml_MT1ALTD8N2F300M12","INDIA'S FOREIGN MINISTER SAYS  HOPES CHINA WILL TAKE NON DISCRIMINATORY APPROACH AND ALLOW INDIAN STUDENTS TO RETURN TO CHINA","tag:reuters.com,2022:newsml_MT1ALTD8N2F300M12:240760178",en,T,1,"INDIA'S FOREIGN MINISTER SAYS  HOPES CHINA WILL TAKE NON DISCRIM","Thomson Reuters",240760178
STK567,25/03/2022 09:11:11,RU|AF|CN|UA|IN,"tag:reuters.com,2022:newsml_MT1ALTD8N2F300M10","INDIA'S FOREIGN MINISTER SAYS  DIPLOMACY AND DIALOGUE MUST BE PRIORITY IN UKRAINE","tag:reuters.com,2022:newsml_MT1ALTD8N2F300M10:853701208",en,T,1,"INDIA'S FOREIGN MINISTER SAYS  DIPLOMACY AND DIALOGUE MUST BE PR","Thomson Reuters",853701208
STK567,25/03/2022 09:10:31,RU|TR|US|UA,"tag:reuters.com,2022:newsml_L5N2VS1Q6","Erdogan says Zelenskiy's referendum call is "smart leadership" -media","tag:reuters.com,2022:newsml_L5N2VS1Q6:1384116226",en,T,2,"UKRAINE-CRISIS/TURKEY-ERDOGAN (URGENT)","Thomson Reuters",1384116226
STK567,25/03/2022 09:10:14,RU|US|UA,"tag:reuters.com,2022:newsml_MT1ALTA5N2VD00410","U.S. PRESIDENT BIDEN:THESE STEPS WILL INCREASE ENERGY AND NATIONAL SECURITY","tag:reuters.com,2022:newsml_MT1ALTA5N2VD00410:1783394824",en,T,1,"U.S. PRESIDENT BIDEN:THESE STEPS WILL INCREASE ENERGY AND NATION","Thomson Reuters",1783394824
STK567,25/03/2022 09:09:45,RU|US|UA,"tag:reuters.com,2022:newsml_MT1ALTA5N2VD0048","U.S. PRESIDENT BIDEN:U.S. AND EUROPE WILL WORK TOGETHER TO ACCELERATE ENERGY TRANSITION","tag:reuters.com,2022:newsml_MT1ALTA5N2VD0048:917320596",en,T,1,"U.S. PRESIDENT BIDEN:U.S. AND EUROPE WILL WORK TOGETHER TO ACCEL","Thomson Reuters",917320596
STK567,25/03/2022 09:09:26,RU|AF|CN|UA|IN,"tag:reuters.com,2022:newsml_MT1ALTD8N2F300M8","INDIA'S FOREIGN MINISTER SAYS  FRICTIONS AND TENSIONS ARISING FROM CHINA'S DEPLOYMENTS CANNOT BE RECONCILED WITH NORMAL RELATIONS","tag:reuters.com,2022:newsml_MT1ALTD8N2F300M8:587498971",en,T,1,"INDIA'S FOREIGN MINISTER SAYS  FRICTIONS AND TENSIONS ARISING FR","Thomson Reuters",587498971
STK567,25/03/2022 09:09:05,RU|TR|DE|UA,"tag:reuters.com,2022:newsml_L5N2VS1S4","Turkey-Russia could implement local currency solution in tourism - Erdogan/TV","tag:reuters.com,2022:newsml_L5N2VS1S4:1552515613",en,T,3,"UKRAINE-CRISIS/TURKEY-RUSSIA","Thomson Reuters",1552515613
STK567,25/03/2022 09:08:48,RU|US|UA,"tag:reuters.com,2022:newsml_MT1ALTA5N2VD0046","U.S. PRESIDENT BIDEN: BUILD OUT OF LNG SHIPMENTS WILL NOT INTERFERE WITH CLIMATE GOALS","tag:reuters.com,2022:newsml_MT1ALTA5N2VD0046:687079939",en,T,1,"U.S. PRESIDENT BIDEN: BUILD OUT OF LNG SHIPMENTS WILL NOT INTERF","Thomson Reuters",687079939
STK567,25/03/2022 09:08:15,RU|AF|CN|UA|IN,"tag:reuters.com,2022:newsml_MT1ALTD8N2F300M6","INDIA'S FOREIGN MINISTER SAYS  DISENGAGEMENT OF TROOPS NECESSARY, CURRENT SITUATION WORK IN PROGRESS","tag:reuters.com,2022:newsml_MT1ALTD8N2F300M6:1470910702",en,T,1,"INDIA'S FOREIGN MINISTER SAYS  DISENGAGEMENT OF TROOPS NECESSARY","Thomson Reuters",1470910702
STK567,25/03/2022 09:07:09,RU|AF|CN|UA|IN,"tag:reuters.com,2022:newsml_MT1ALTD8N2F300M4","INDIA'S FOREIGN MINISTER SAYS  EXCHANGED VIEWS ON MAJOR INTERNATIONAL ISSUES INCLUDING AFGHANISTAN AND UKRAINE","tag:reuters.com,2022:newsml_MT1ALTD8N2F300M4:744735771",en,T,1,"INDIA'S FOREIGN MINISTER SAYS  EXCHANGED VIEWS ON MAJOR INTERNAT","Thomson Reuters",744735771
STK567,25/03/2022 09:07:09,RU|US|UA,"tag:reuters.com,2022:newsml_MT1ALTA5N2VD0044","U.S. PRESIDENT BIDEN:WE SHOULD NOT SUBSIDISE PUTIN'S BRUTAL ATTACK ON UKRAINE","tag:reuters.com,2022:newsml_MT1ALTA5N2VD0044:745166680",en,T,1,"U.S. PRESIDENT BIDEN:WE SHOULD NOT SUBSIDISE PUTIN'S BRUTAL ATTA","Thomson Reuters",745166680
STK567,25/03/2022 09:06:39,RU|US|UA,"tag:reuters.com,2022:newsml_MT1ALTA5N2VD0042","U.S. PRESIDENT BIDEN:WE ARE COMING TOGETHER TO REDUCE EUROPE'S DEPENDENCY ON RUSSIAN ENERGY","tag:reuters.com,2022:newsml_MT1ALTA5N2VD0042:909345855",en,T,1,"U.S. PRESIDENT BIDEN:WE ARE COMING TOGETHER TO REDUCE EUROPE'S D","Thomson Reuters",909345855
STK567,25/03/2022 09:06:32,CN|IN,"tag:reuters.com,2022:newsml_MT1ALTD8N2F300M2","INDIA'S FOREIGN MINISTER SAYS  HELD 3 HOURS LONG TALKS WITH CHINESE COUNTERPART","tag:reuters.com,2022:newsml_MT1ALTD8N2F300M2:88031659",en,T,1,"INDIA'S FOREIGN MINISTER SAYS  HELD 3 HOURS LONG TALKS WITH CHIN","Thomson Reuters",88031659
STK567,25/03/2022 09:05:08,,"tag:reuters.com,2022:newsml_MTZXEI3PAMKKM2","World Cup Qualifiers (Europe) Fixtures","tag:reuters.com,2022:newsml_MTZXEI3PAMKKM2:1",en,T,4,"SOCCER-WORLDCUP/FIXTURES","Opta Sports Data",1
STK567,25/03/2022 09:05:08,,"tag:reuters.com,2022:newsml_MTZXEI3PAMKKLZ","World Cup Qualifiers (South America) Fixtures","tag:reuters.com,2022:newsml_MTZXEI3PAMKKLZ:1",en,T,4,"SOCCER-WORLDCUP/FIXTURES","Opta Sports Data",1
STK567,25/03/2022 09:05:08,,"tag:reuters.com,2022:newsml_MTZXEI3PAMKKM0","Super Rugby Fixtures","tag:reuters.com,2022:newsml_MTZXEI3PAMKKM0:1",en,T,4,"RUGBY-UNION-SUPER/FIXTURES","Opta Sports Data",1
STK567,25/03/2022 09:05:08,,"tag:reuters.com,2022:newsml_MTZXEI3PAMKKLY","Friendlies Fixtures","tag:reuters.com,2022:newsml_MTZXEI3PAMKKLY:1",en,T,4,"SOCCER-FRIENDLY/FIXTURES","Opta Sports Data",1
STK567,25/03/2022 09:05:08,US,"tag:reuters.com,2022:newsml_MTZXEI3PAMKKLW","MLS Fixtures","tag:reuters.com,2022:newsml_MTZXEI3PAMKKLW:1",en,T,4,"SOCCER-USA/FIXTURES","Opta Sports Data",1
STK567,25/03/2022 09:05:08,,"tag:reuters.com,2022:newsml_MTZXEI3PAMKKLV","World Cup Qualifiers (Africa) Fixtures","tag:reuters.com,2022:newsml_MTZXEI3PAMKKLV:1",en,T,4,"SOCCER-WORLDCUP/FIXTURES","Opta Sports Data",1
STK567,25/03/2022 09:05:08,,"tag:reuters.com,2022:newsml_MTZXEI3PAMKKM1","World Cup Qualifiers (North America) Fixtures","tag:reuters.com,2022:newsml_MTZXEI3PAMKKM1:1",en,T,4,"SOCCER-WORLDCUP/FIXTURES","Opta Sports Data",1
STK567,25/03/2022 09:05:08,,"tag:reuters.com,2022:newsml_MTZXEI3PAMKKLX","World Cup Qualifiers (Oceania) Fixtures","tag:reuters.com,2022:newsml_MTZXEI3PAMKKLX:1",en,T,4,"SOCCER-WORLDCUP/FIXTURES","Opta Sports Data",1
STK567,25/03/2022 09:05:07,,"tag:reuters.com,2022:newsml_MTZXEI3PAMKKLU","World Cup Qualifiers (Asia) Fixtures","tag:reuters.com,2022:newsml_MTZXEI3PAMKKLU:1",en,T,4,"SOCCER-WORLDCUP/FIXTURES","Opta Sports Data",1
STK567,25/03/2022 09:03:15,RU,"tag:reuters.com,2022:newsml_MT1ALTR4N2UF0076","SPEAKER OF RUSSIAN LOWER HOUSE OF PARLIAMENT SAYS HIS CONDITION IS GRAVE AND THAT DOCTORS ARE FIGHTING FOR HIS LIFE","tag:reuters.com,2022:newsml_MT1ALTR4N2UF0076:1587834452",en,T,1,"SPEAKER OF RUSSIAN LOWER HOUSE OF PARLIAMENT SAYS HIS CONDITION","Thomson Reuters",1587834452
STK567,25/03/2022 09:02:54,IL|TR|PS|US,"tag:reuters.com,2022:newsml_L5N2VS1PX","Erdogan says Turkey, Israel can work on gas amid push to mend ties -media","tag:reuters.com,2022:newsml_L5N2VS1PX:1416814808",en,T,2,"TURKEY-ISRAEL/ENERGY (URGENT)","Thomson Reuters",1416814808
STK567,25/03/2022 09:01:55,RU,"tag:reuters.com,2022:newsml_MT1ALTR4N2UF0074","SPEAKER OF RUSSIAN LOWER HOUSE OF PARLIAMENT SAYS ULTRA-NATIONALIST POLITICIAN VLADIMIR ZHIRINOVSKY IS ALIVE DESPITE REPORTS TO THE CONTRARY","tag:reuters.com,2022:newsml_MT1ALTR4N2UF0074:359744608",en,T,1,"SPEAKER OF RUSSIAN LOWER HOUSE OF PARLIAMENT SAYS ULTRA-NATIONAL","Thomson Reuters",359744608
STK567,25/03/2022 09:01:54,RU|TR|DE|UA,"tag:reuters.com,2022:newsml_MT1ALTL5N2VS1S42","ERDOGAN SAYS MAY IMPLEMENT A TOURISM-RELATED SOLUTION WITH RUSSIA BY USING LOCAL CURRENCIES -MEDIA","tag:reuters.com,2022:newsml_MT1ALTL5N2VS1S42:678642531",en,T,1,"ERDOGAN SAYS MAY IMPLEMENT A TOURISM-RELATED SOLUTION WITH RUSSI","Thomson Reuters",678642531
STK567,25/03/2022 09:01:53,RU|TR|DE|UA,"tag:reuters.com,2022:newsml_MT1ALTL5N2VS1S41","TURKEY'S ERDOGAN SAYS IT WOULD BE "AMBITIOUS" TO EXPECT SERIOUS INCREASE IN TOURISM THIS YEAR -MEDIA","tag:reuters.com,2022:newsml_MT1ALTL5N2VS1S41:1543662643",en,T,1,"TURKEY'S ERDOGAN SAYS IT WOULD BE "AMBITIOUS" TO EXPECT SERIOUS","Thomson Reuters",1543662643
STK567,25/03/2022 09:01:52,IL|TR|PS|US,"tag:reuters.com,2022:newsml_MT1ALTL5N2VS1PX2","ERDOGAN SAYS NATURAL GAS MOST IMPORTANT STEP TURKEY, ISRAEL CAN TAKE TO IMPROVE TIES -MEDIA","tag:reuters.com,2022:newsml_MT1ALTL5N2VS1PX2:2057806860",en,T,1,"ERDOGAN SAYS NATURAL GAS MOST IMPORTANT STEP TURKEY, ISRAEL CAN","Thomson Reuters",2057806860
STK567,25/03/2022 09:01:51,IL|TR|PS|US,"tag:reuters.com,2022:newsml_MT1ALTL5N2VS1PX1","ERDOGAN SAYS ISRAELI PM BENNETT MAY VISIT TURKEY -MEDIA","tag:reuters.com,2022:newsml_MT1ALTL5N2VS1PX1:1872659928",en,T,1,"ERDOGAN SAYS ISRAELI PM BENNETT MAY VISIT TURKEY -MEDIA","Thomson Reuters",1872659928
STK567,25/03/2022 09:01:34,RU|IT|TR|FR|US|UA,"tag:reuters.com,2022:newsml_MT1ALTL5N2VS1Q23","ERDOGAN, ASKED ABOUT REPORTS OF U.S. ASKING TURKEY TO SEND S-400S TO UKRAINE, SAYS "ALL THEY DO IS CAUSE COMMOTION" -MEDIA","tag:reuters.com,2022:newsml_MT1ALTL5N2VS1Q23:449087656",en,T,1,"ERDOGAN, ASKED ABOUT REPORTS OF U.S. ASKING TURKEY TO SEND S-400","Thomson Reuters",449087656
STK567,25/03/2022 09:01:34,RU|IT|TR|FR|US|UA,"tag:reuters.com,2022:newsml_MT1ALTL5N2VS1Q24","ERDOGAN SAYS HE DISCUSSED EUROSAM SAMP-T MISSILE DEFENCE SYSTEMS WITH FRANCE'S MACRON, ITALY'S DRAGHI AT NATO SUMMIT -MEDIA","tag:reuters.com,2022:newsml_MT1ALTL5N2VS1Q24:137102486",en,T,1,"ERDOGAN SAYS HE DISCUSSED EUROSAM SAMP-T MISSILE DEFENCE SYSTEMS","Thomson Reuters",137102486
STK567,25/03/2022 09:01:32,RU|IT|TR|FR|US|UA,"tag:reuters.com,2022:newsml_MT1ALTL5N2VS1Q22","ERDOGAN SAYS TURKEY'S POSITION ON PURCHASE OF RUSSIAN S-400S IS UNCHANGED, IT IS A "DONE DEAL" -MEDIA","tag:reuters.com,2022:newsml_MT1ALTL5N2VS1Q22:1457991639",en,T,1,"ERDOGAN SAYS TURKEY'S POSITION ON PURCHASE OF RUSSIAN S-400S IS","Thomson Reuters",1457991639
STK567,25/03/2022 09:01:31,RU|IT|TR|FR|US|UA,"tag:reuters.com,2022:newsml_MT1ALTL5N2VS1Q21","TURKEY'S ERDOGAN SAYS PROCESS WITH U.S. ON NEW F-16 JETS, MODERNISATION KITS GOING POSITIVELY -MEDIA","tag:reuters.com,2022:newsml_MT1ALTL5N2VS1Q21:1622059684",en,T,1,"TURKEY'S ERDOGAN SAYS PROCESS WITH U.S. ON NEW F-16 JETS, MODERN","Thomson Reuters",1622059684
STK567,25/03/2022 09:01:15,CH|IT|GB|JP|CN|FR|DE|US|ES,"tag:reuters.com,2022:newsml_L5N2VS1V6","MORNING BID-Rialzo tassi non disturba nemmeno Giappone","tag:reuters.com,2022:newsml_L5N2VS1V6:1667560914",it,T,3,"MORNING-BID/","Thomson Reuters",1667560914
STK567,25/03/2022 09:00:46,RU|TR|US|UA,"tag:reuters.com,2022:newsml_MT1ALTL5N2VS1Q64","ERDOGAN, ASKED ABOUT SANCTIONS ON RUSSIA, SAYS "NOTHING CAN BE DONE" DUE TO TURKEY'S ENERGY NEEDS -MEDIA","tag:reuters.com,2022:newsml_MT1ALTL5N2VS1Q64:1136557806",en,T,1,"ERDOGAN, ASKED ABOUT SANCTIONS ON RUSSIA, SAYS "NOTHING CAN BE D","Thomson Reuters",1136557806
STK567,25/03/2022 09:00:46,RU|TR|US|UA,"tag:reuters.com,2022:newsml_MT1ALTL5N2VS1Q63","TURKEY'S ERDOGAN SAYS HE WILL SPEAK TO UKRAINE'S ZELENSKIY, RUSSIA'S PUTIN IN COMING DAYS TO EVALUATE NATO SUMMIT -MEDIA","tag:reuters.com,2022:newsml_MT1ALTL5N2VS1Q63:1522954061",en,T,1,"TURKEY'S ERDOGAN SAYS HE WILL SPEAK TO UKRAINE'S ZELENSKIY, RUSS","Thomson Reuters",1522954061
