channel,dateCreated,geography,guid,headline,id,language,mediaType,priority,slug,source,version
STK567,25/03/2022 09:00:45,RU|TR|US|UA,"tag:reuters.com,2022:newsml_MT1ALTL5N2VS1Q62","TURKEY'S ERDOGAN SAYS UKRAINIAN PRESIDENT ZELENSKIY'S CALL FOR A REFERENDUM ON ISSUES WITH RUSSIA IS "SMART LEADERSHIP" -MEDIA","tag:reuters.com,2022:newsml_MT1ALTL5N2VS1Q62:719293221",en,T,1,"TURKEY'S ERDOGAN SAYS UKRAINIAN PRESIDENT ZELENSKIY'S CALL FOR A","Thomson Reuters",719293221
STK567,25/03/2022 09:00:44,RU|TR|US|UA,"tag:reuters.com,2022:newsml_MT1ALTL5N2VS1Q61","TURKEY'S ERDOGAN SAYS RUSSIA, UKRAINE CAN REACH COMPROMISE ON FOUR OF SIX ISSUES DISCUSSED, TERRITORIAL DISPUTES REMAINS -MEDIA","tag:reuters.com,2022:newsml_MT1ALTL5N2VS1Q61:716368440",en,T,1,"TURKEY'S ERDOGAN SAYS RUSSIA, UKRAINE CAN REACH COMPROMISE ON FO","Thomson Reuters",716368440
STK567,25/03/2022 08:58:40,AU|NZ|CN|SB|US,"tag:reuters.com,2022:newsml_L2N2VS04Z","UPDATE 4-Solomons confirms security talks with China; Australia and NZ concerned","tag:reuters.com,2022:newsml_L2N2VS04Z:1410963812",en,T,3,"AUSTRALIA-PACIFIC/SOLOMON ISLANDS (UPDATE 4)","Thomson Reuters",1410963812
STK567,25/03/2022 08:57:39,RU|UA,"tag:reuters.com,2022:newsml_MT1ALTL5N2VS20G1","UKRAINIAN CITY OF CHERNIHIV IS NOW CUT OFF BY RUSSIAN FORCES- REGIONAL GOVERNOR","tag:reuters.com,2022:newsml_MT1ALTL5N2VS20G1:391515720",en,T,1,"UKRAINIAN CITY OF CHERNIHIV IS NOW CUT OFF BY RUSSIAN FORCES- RE","Thomson Reuters",391515720
STK567,25/03/2022 08:54:17,RU,"tag:reuters.com,2022:newsml_MT1ALTR4N2UF0072","RUSSIAN VETERAN POLITICIAN AND SENIOR LAWMAKER ZHIRINOVSKY HAS DIED - RIA CITES LAWMAKER","tag:reuters.com,2022:newsml_MT1ALTR4N2UF0072:2067467195",en,T,1,"RUSSIAN VETERAN POLITICIAN AND SENIOR LAWMAKER ZHIRINOVSKY HAS D","Thomson Reuters",2067467195
STK567,25/03/2022 08:51:12,RU|UA,"tag:reuters.com,2022:newsml_S8N2UZ0C7","Ukrainian aid centre hit by Russian shelling, four killed, say police","tag:reuters.com,2022:newsml_S8N2UZ0C7:1351487944",en,T,2,"UKRAINE-CRISIS/KHARKIV-CLINIC (URGENT)","Thomson Reuters",1351487944
STK567,25/03/2022 08:50:56,CN,"tag:reuters.com,2022:newsml_L2N2VS0EY","China, HK stocks fall on hawkish Fed, U.S. regulatory concerns","tag:reuters.com,2022:newsml_L2N2VS0EY:1904867349",en,T,3,"CHINA-STOCKS/CLOSE (UPDATE 1)","Thomson Reuters",1904867349
STK567,25/03/2022 08:50:37,RU|UA,"tag:reuters.com,2022:newsml_L5N2VS1T7","UPDATE 1-U.S, EU strike LNG deal as Europe seeks to cut Russian gas","tag:reuters.com,2022:newsml_L5N2VS1T7:1442122076",en,T,3,"UKRAINE-CRISIS/EU-ENERGY (UPDATE 1)","Thomson Reuters",1442122076
STK567,25/03/2022 08:47:25,CH|IT|GB|JP|CN|FR|DE|US|ES,"tag:reuters.com,2022:newsml_L2N2VS0FT","GLOBAL MARKETS-World stocks set for consecutive weekly gains for first time in 2022","tag:reuters.com,2022:newsml_L2N2VS0FT:871195214",en,T,3,"GLOBAL-MARKETS/ (WRAPUP 2, PIX)","Thomson Reuters",871195214
STK567,25/03/2022 08:45:02,RU|GB|BY|US|UA,"tag:reuters.com,2022:newsml_L9N2U501A","Ukraine has retaken towns 35km east of Kyiv, UK says","tag:reuters.com,2022:newsml_L9N2U501A:1932327599",en,T,2,"UKRAINE-CRISIS/BRITAIN-INTELLIGENCE (URGENT)","Thomson Reuters",1932327599
STK567,25/03/2022 08:44:25,RU|US|UA,"tag:reuters.com,2022:newsml_R4N2VE01U","Russia's National Settlement Depository says Clearstream is blocking its account -Ifx","tag:reuters.com,2022:newsml_R4N2VE01U:1226159951",en,T,2,"UKRAINE-CRISIS/RUSSIA-SETTLEMENT (URGENT)","Thomson Reuters",1226159951
STK567,25/03/2022 08:44:02,RU|GB|BY|FR|DE|BE|US|UA|PL,"tag:reuters.com,2022:newsml_P6N2VB01S","EU leaders to discuss ways to bring energy prices down - Belgium","tag:reuters.com,2022:newsml_P6N2VB01S:634638148",en,T,2,"UKRAINE-CRISIS-EU-BELGIUM (URGENT)","Thomson Reuters",634638148
STK567,25/03/2022 08:41:44,,"tag:reuters.com,2022:newsml_L5N2VS1O6","Euro zone bond yields dip ahead of business sentiment data","tag:reuters.com,2022:newsml_L5N2VS1O6:557503534",en,T,3,"EUROZONE-BONDS/","Thomson Reuters",557503534
STK567,25/03/2022 08:41:00,RU|UA,"tag:reuters.com,2022:newsml_MT1ALTS8N2UZ0C72","RUSSIAN SHELLING OF CLINIC IN UKRAINE'S KHARKIV CITY KILLS FOUR - POLICE","tag:reuters.com,2022:newsml_MT1ALTS8N2UZ0C72:35511916",en,T,1,"RUSSIAN SHELLING OF CLINIC IN UKRAINE'S KHARKIV CITY KILLS FOUR","Thomson Reuters",35511916
STK567,25/03/2022 08:36:32,CN,"tag:reuters.com,2022:newsml_P8N2ST01G","Hong Kong reports 10,405 new daily coronavirus infections","tag:reuters.com,2022:newsml_P8N2ST01G:518908575",en,T,2,"HEALTH-CORONAVIRUS/HONGKONG (URGENT)","Thomson Reuters",518908575
STK567,25/03/2022 08:35:56,CN,"tag:reuters.com,2022:newsml_MT1ALTP8N2ST01G4","HONG KONG HEALTH AUTHORITIES REPORT 192 NEW COVID-19 DEATHS","tag:reuters.com,2022:newsml_MT1ALTP8N2ST01G4:268223901",en,T,1,"HONG KONG HEALTH AUTHORITIES REPORT 192 NEW COVID-19 DEATHS","Thomson Reuters",268223901
STK567,25/03/2022 08:33:24,RU|UA,"tag:reuters.com,2022:newsml_B5N2G102I","U.S. to supply 15 bcm of additional LNG to Europe in 2022","tag:reuters.com,2022:newsml_B5N2G102I:1012649692",en,T,3,"UKRAINE-CRISIS/EU-ENERGY (URGENT)","Thomson Reuters",1012649692
STK567,25/03/2022 08:33:00,CN,"tag:reuters.com,2022:newsml_MT1ALTP8N2ST01G2","HONG KONG HEALTH AUTHORITIES REPORT 10,405 NEW COVID-19 CASES","tag:reuters.com,2022:newsml_MT1ALTP8N2ST01G2:1317780834",en,T,1,"HONG KONG HEALTH AUTHORITIES REPORT 10,405 NEW COVID-19 CASES","Thomson Reuters",1317780834
STK567,25/03/2022 08:32:37,NP|PK|AF|CN|UA|IN,"tag:reuters.com,2022:newsml_L2N2VS06Y","UPDATE 3-India tells Chinese minister border disengagement key to better ties - sources","tag:reuters.com,2022:newsml_L2N2VS06Y:886538956",en,T,3,"INDIA-CHINA/ (UPDATE 3, TV, PIX)","Thomson Reuters",886538956
STK567,25/03/2022 08:31:47,RU|US|UA,"tag:reuters.com,2022:newsml_L5N2VS1NQ","UPDATE 1-Biden seals LNG deal as EU grapples with energy crunch","tag:reuters.com,2022:newsml_L5N2VS1NQ:1004005029",en,T,3,"UKRAINE-CRISIS/EU (UPDATE 1, PIX, TV)","Thomson Reuters",1004005029
STK567,25/03/2022 08:31:28,RU|US|UA,"tag:reuters.com,2022:newsml_MT1ALTR4N2VE01U2","RUSSIAN NATIONAL SETTLEMENT DEPOSITORY SAYS CLEARSTREAM INFORMED IT ABOUT BLOCKING ITS ACCOUNT - IFAX","tag:reuters.com,2022:newsml_MT1ALTR4N2VE01U2:1861746717",en,T,1,"RUSSIAN NATIONAL SETTLEMENT DEPOSITORY SAYS CLEARSTREAM INFORMED","Thomson Reuters",1861746717
STK567,25/03/2022 08:30:22,RU|UA,"tag:reuters.com,2022:newsml_L2N2VS0F5","UPDATE 1-Ukraine makes new effort to evacuate Mariupol civilians","tag:reuters.com,2022:newsml_L2N2VS0F5:1047877179",en,T,3,"UKRAINE-CRISIS/MARIUPOL (UPDATE 1, PIX)","Thomson Reuters",1047877179
STK567,25/03/2022 08:29:26,RU|GB|BY|FR|DE|US|UA|PL,"tag:reuters.com,2022:newsml_MT1ALTP6N2VB01S2","BELGIAN PM DE CROO SAYS THERE WILL EU MEMBERS WILL BE DISCUSSING WAYS TO BRING ENERGY PRICES DOWN","tag:reuters.com,2022:newsml_MT1ALTP6N2VB01S2:309504907",en,T,1,"BELGIAN PM DE CROO SAYS THERE WILL EU MEMBERS WILL BE DISCUSSING","Thomson Reuters",309504907
STK567,25/03/2022 08:29:00,CH|IT|GB|FR|DE|ES,"tag:reuters.com,2022:newsml_L3N2VS1V9","European shares slip as crisis in Ukraine deepens","tag:reuters.com,2022:newsml_L3N2VS1V9:159343485",en,T,2,"EUROPE-STOCKS/ (URGENT)","Thomson Reuters",159343485
STK567,25/03/2022 08:27:32,AT|GB|QA|UA,"tag:reuters.com,2022:newsml_L2N2VS0EK","Soccer-Bale proves worth to Wales yet again","tag:reuters.com,2022:newsml_L2N2VS0EK:930208858",en,T,3,"SOCCER-WORLDCUP-WAL-AUT/REPORT (PIX)","Thomson Reuters",930208858
STK567,25/03/2022 08:24:00,RU|GB,"tag:reuters.com,2022:newsml_L3N2VS1UQ","Oil, weak consumer confidence data keep FTSE 100 under pressure","tag:reuters.com,2022:newsml_L3N2VS1UQ:1365854808",en,T,2,"BRITAIN-STOCKS/ (URGENT)","Thomson Reuters",1365854808
STK567,25/03/2022 08:23:43,RU|UA,"tag:reuters.com,2022:newsml_R4N2VE02I","Russian health regulator says medicine shortage due to spike in demand","tag:reuters.com,2022:newsml_R4N2VE02I:785273318",en,T,2,"UKRAINE-CRISIS/RUSSIA-MEDICINE (URGENT)","Thomson Reuters",785273318
STK567,25/03/2022 08:21:21,RU|GB|UA,"tag:reuters.com,2022:newsml_L3N2VS1OV","UPDATE 1-Miner Petropavlovsk caught in crosshairs of UK sanctions against Gazprombank","tag:reuters.com,2022:newsml_L3N2VS1OV:1457889489",en,T,3,"UKRAINE-CRISIS/PETROPAVLOVSK (UPDATE 1)","Thomson Reuters",1457889489
STK567,25/03/2022 08:18:14,MM|NO,"tag:reuters.com,2022:newsml_L5N2VS0YX","Telenor completes Myanmar business sale, to be paid over 5 years","tag:reuters.com,2022:newsml_L5N2VS0YX:1153240486",en,T,3,"MYANMAR-TELENOR/","Thomson Reuters",1153240486
STK567,25/03/2022 08:17:31,RU|AU|JP|BY|US|UA|PL,"tag:reuters.com,2022:newsml_L2N2VS08N","TOP WRAP 4-Ukrainian forces advance east of Kyiv as Russians fall back","tag:reuters.com,2022:newsml_L2N2VS08N:455993997",en,T,3,"UKRAINE-CRISIS/ (TOP WRAP 4, PIX, GRAPHIC)","Thomson Reuters",455993997
STK567,25/03/2022 08:13:37,RU|UA,"tag:reuters.com,2022:newsml_L5N2VS1J8","Thousands flee city near Ukrainian international airport","tag:reuters.com,2022:newsml_L5N2VS1J8:1564486209",en,T,2,"UKRAINE-CRISIS/BORYSPIL (URGENT)","Thomson Reuters",1564486209
STK567,25/03/2022 08:11:42,AU|NZ|CN|SB|US,"tag:reuters.com,2022:newsml_L2N2VS04Z","UPDATE 3-Solomons confirms security talks with China; Australia and NZ concerned","tag:reuters.com,2022:newsml_L2N2VS04Z:1726719745",en,T,3,"AUSTRALIA-PACIFIC/SOLOMON ISLANDS (UPDATE 3)","Thomson Reuters",1726719745
STK567,25/03/2022 08:08:09,,"tag:reuters.com,2022:newsml_MTZXEI3O95DKSZ","UPDATE 27-Friendlies Summaries","tag:reuters.com,2022:newsml_MTZXEI3O95DKSZ:27",en,T,4,"SOCCER-FRIENDLY/SUMMARIES (UPDATE 27)","Opta Sports Data",27
STK567,25/03/2022 08:08:09,,"tag:reuters.com,2022:newsml_MTZXEI3O95DJSY","UPDATE 11-Friendlies Results","tag:reuters.com,2022:newsml_MTZXEI3O95DJSY:11",en,T,4,"SOCCER-FRIENDLY/RESULTS (UPDATE 11)","Opta Sports Data",11
STK567,25/03/2022 08:06:57,GB,"tag:reuters.com,2022:newsml_L5N2VS1DI","Anglo American completes exit from S.African coal miner Thungela","tag:reuters.com,2022:newsml_L5N2VS1DI:1042216294",en,T,3,"ANGLO AMERICAN-SALE/THUNGELA RSRCS","Thomson Reuters",1042216294
STK567,25/03/2022 08:04:01,RU|BY|US|UA,"tag:reuters.com,2022:newsml_R4N2VE02H","Russia says it destroyed fuel depot outside Kyiv in missile strike","tag:reuters.com,2022:newsml_R4N2VE02H:1380903161",en,T,2,"UKRAINE-CRISIS/RUSSIA-FUEL-DEPOT (URGENT)","Thomson Reuters",1380903161
STK567,25/03/2022 08:03:55,CH|IT|GB|JP|CN|FR|DE|US|ES,"tag:reuters.com,2022:newsml_L5N2VS1GA","MORNING BID-Now even Japan seems ok with rising bond yields","tag:reuters.com,2022:newsml_L5N2VS1GA:1757289487",en,T,3,"MARKETS-EUROPE/VIEW","Thomson Reuters",1757289487
STK567,25/03/2022 08:03:09,RU|UA,"tag:reuters.com,2022:newsml_L5N2VS1H8","Ukraine's new agriculture minister warns over global food prices","tag:reuters.com,2022:newsml_L5N2VS1H8:66215407",en,T,2,"UKRAINE-CRISIS/AGRICULTURE-MINISTER (URGENT)","Thomson Reuters",66215407
STK567,25/03/2022 08:02:13,SA|DE|US,"tag:reuters.com,2022:newsml_L2N2VS0CY","UPDATE 1-Motor racing-Hulkenberg to step in again for Vettel at Saudi Arabian GP","tag:reuters.com,2022:newsml_L2N2VS0CY:405288169",en,T,3,"MOTOR-F1-SAUDI/ (UPDATE 1, PIX, TV)","Thomson Reuters",405288169
STK567,25/03/2022 08:00:09,RU|UA,"tag:reuters.com,2022:newsml_MT1ALTL5N2VS1J81","MAYOR OF BORISPYL, A UKRAINIAN CITY NEAR INTERNATIONAL AIRPORT, SAYS 20,000 CIVILIANS HAVE FLED THE CITY, URGES OTHERS TO FLEE","tag:reuters.com,2022:newsml_MT1ALTL5N2VS1J81:1570341182",en,T,1,"MAYOR OF BORISPYL, A UKRAINIAN CITY NEAR INTERNATIONAL AIRPORT,","Thomson Reuters",1570341182
STK567,25/03/2022 07:56:48,RU|US|UA,"tag:reuters.com,2022:newsml_L5N2VS1HI","Biden to seal LNG deal as EU grapples with energy crunch","tag:reuters.com,2022:newsml_L5N2VS1HI:537132029",en,T,3,"UKRAINE-CRISIS/EU (PIX, TV)","Thomson Reuters",537132029
STK567,25/03/2022 07:56:09,,"tag:reuters.com,2022:newsml_L2N2VS0DO","Reuters Sports News Summary","tag:reuters.com,2022:newsml_L2N2VS0DO:1935811323",en,T,4,"BC-SPORTS","Thomson Reuters",1935811323
STK567,25/03/2022 07:55:28,JP,"tag:reuters.com,2022:newsml_T9N2LT00M","Japan extends fuel subsidies to counter inflation until end-April","tag:reuters.com,2022:newsml_T9N2LT00M:213344467",en,T,2,"JAPAN-ECONOMY/SUBSIDIES (URGENT)","Thomson Reuters",213344467
STK567,25/03/2022 07:52:01,AU|NZ|CN|SB|US,"tag:reuters.com,2022:newsml_B9N2UP00Q","China supports Solomon Islands in maintaining social order","tag:reuters.com,2022:newsml_B9N2UP00Q:1856034385",en,T,2,"AUSTRALIA-PACIFIC/SOLOMON ISLANDS-CHINA (URGENT)","Thomson Reuters",1856034385
STK567,25/03/2022 07:50:28,RU|UA,"tag:reuters.com,2022:newsml_MT1ALTL5N2VS1H82","IF THE SITUATION IN UKRAINE IS NOT RESOLVED, FOOD PRICES IN THE WORLD WILL CONTINUE TO RISE - UKRAINE'S NEW AGRICULTURE MINISTER","tag:reuters.com,2022:newsml_MT1ALTL5N2VS1H82:1541593418",en,T,1,"IF THE SITUATION IN UKRAINE IS NOT RESOLVED, FOOD PRICES IN THE","Thomson Reuters",1541593418
STK567,25/03/2022 07:48:39,RU|BY|US|UA,"tag:reuters.com,2022:newsml_MT1ALTR4N2VE02H2","RUSSIAN DEFENCE MINISTRY SAYS RUSSIA DESTROYED MAJOR FUEL DEPOT OUTSIDE KYIV WITH 'KALIBR' MISSILE STRIKE - IFAX","tag:reuters.com,2022:newsml_MT1ALTR4N2VE02H2:2070154460",en,T,1,"RUSSIAN DEFENCE MINISTRY SAYS RUSSIA DESTROYED MAJOR FUEL DEPOT","Thomson Reuters",2070154460
STK567,25/03/2022 07:48:33,AU|PK,"tag:reuters.com,2022:newsml_L3N2VS17K","Cricket-Imam holds firm as Pakistan reach 136-2 at lunch chasing 351","tag:reuters.com,2022:newsml_L3N2VS17K:1769183980",en,T,3,"CRICKET-TEST-PAK-AUS/","Thomson Reuters",1769183980
STK567,25/03/2022 07:48:06,RU|UA,"tag:reuters.com,2022:newsml_MT1ALTL5N2VS1H81","UKRAINE'S NEW AGRICULTURE MINISTER SAYS UKRAINE'S GRAIN STOCKS FOR EXPORT AMOUNT TO $7.5 BILLION, DOES NOT SAY WHAT VOLUME","tag:reuters.com,2022:newsml_MT1ALTL5N2VS1H81:1226044882",en,T,1,"UKRAINE'S NEW AGRICULTURE MINISTER SAYS UKRAINE'S GRAIN STOCKS F","Thomson Reuters",1226044882
